{
  "instrument": "PI_XBTUSD",
  "timeframe": "1m",
  "start_ts": "2026-02-15T00:00:00Z",
  "end_ts": "2026-02-15T00:02:00Z",
  "candles": [
    {
      "ts": "2026-02-15T00:00:00Z",
      "open": 50000.0,
      "high": 50010.0,
      "low": 49990.0,
      "close": 50005.0,
      "volume": 12.3
    },
    {
      "ts": "2026-02-15T00:02:00Z",
      "open": 50015.0,
      "high": 50025.0,
      "low": 50010.0,
      "close": 50012.0,
      "volume": 9.4
    }
  ],
  "integrity": {
    "status": "INCOMPLETE",
    "coverage_pct": 66.6667,
    "missing_ranges": [
      {
        "start_ts": "2026-02-15T00:01:00Z",
        "end_ts": "2026-02-15T00:01:00Z",
        "reason": "missing_candle"
      }
    ],
    "last_verified_at": "2026-02-15T00:03:00Z",
    "warnings": [
      "detected 1 missing interval(s) in requested range"
    ]
  }
}
